{
  "schemaVersion": "1.0.0",
  "datasetVersion": "2026-10-13.1",
  "selfId": "self",
  "fields": [
    {
      "key": "fa",
      "label": "父",
      "legacyName": "父亲"
    },
    {
      "key": "mu",
      "label": "母",
      "legacyName": "母亲"
    },
    {
      "key": "xiong",
      "label": "兄",
      "legacyName": "兄亲"
    },
    {
      "key": "di",
      "label": "弟",
      "legacyName": "弟亲"
    },
    {
      "key": "jie",
      "label": "姐",
      "legacyName": "姊亲"
    },
    {
      "key": "mei",
      "label": "妹",
      "legacyName": "妹亲"
    },
    {
      "key": "fu",
      "label": "夫",
      "legacyName": "夫亲"
    },
    {
      "key": "qi",
      "label": "妻",
      "legacyName": "妻亲"
    },
    {
      "key": "zi",
      "label": "子",
      "legacyName": "男亲"
    },
    {
      "key": "nv",
      "label": "女",
      "legacyName": "女亲"
    }
  ],
  "sources": [
    {
      "id": "phase1-legacy",
      "kind": "legacy",
      "title": "Phase 1 compatible graph",
      "scope": "Existing role edges and display words; role usage has not been linguistically reviewed."
    },
    {
      "id": "chart-v1",
      "kind": "chart",
      "title": "莆仙话亲属称谓关系图 v1.0（莆田腔版本）",
      "uri": "https://github.com/user-attachments/assets/3aacc81d-7607-45d6-815c-7721fdf7c905",
      "scope": "User supplied chart, 莆仙乡音社, 2026-02-01; family branches and selected role definitions."
    },
    {
      "id": "sqlite-snapshot",
      "kind": "databaseSnapshot",
      "title": "兴化语记当前数据.sqlite3",
      "scope": "User supplied snapshot, inspected 2026-10-13; exact word/ID binding only, not role applicability or live database freshness."
    },
    {
      "id": "role-normalization",
      "kind": "inference",
      "title": "Phase 1 relation target normalization",
      "scope": "Mandarin role labels/definitions inferred from existing relation edges; not confirmed dialect words."
    }
  ],
  "nodes": [
    {
      "id": "self",
      "label": "己身",
      "sex": "unknown",
      "kind": "person",
      "relations": {
        "fa": "father",
        "mu": "mother",
        "xiong": "older-brother",
        "di": "younger-brother",
        "jie": "older-sister",
        "mei": "younger-sister",
        "fu": "husband",
        "qi": "wife",
        "zi": "son",
        "nv": "daughter"
      },
      "termIds": [
        "term-001"
      ],
      "provenance": [
        "phase1-legacy"
      ],
      "legacyName": "己身"
    },
    {
      "id": "ancestors",
      "label": "祖先",
      "sex": "unknown",
      "kind": "collective",
      "relations": {
        "fa": null,
        "mu": null,
        "xiong": null,
        "di": null,
        "jie": null,
        "mei": null,
        "fu": null,
        "qi": null,
        "zi": null,
        "nv": null
      },
      "termIds": [
        "term-002"
      ],
      "provenance": [
        "phase1-legacy"
      ],
      "legacyName": "祖先"
    },
    {
      "id": "paternal-great-great-grandfather",
      "label": "高祖父",
      "sex": "male",
      "kind": "person",
      "relations": {
        "fa": null,
        "mu": null,
        "xiong": null,
        "di": null,
        "jie": null,
        "mei": null,
        "fu": null,
        "qi": "paternal-great-great-grandmother",
        "zi": "paternal-great-grandfather",
        "nv": null
      },
      "termIds": [
        "term-003"
      ],
      "provenance": [
        "phase1-legacy"
      ],
      "legacyName": "高祖父"
    },
    {
      "id": "paternal-great-great-grandmother",
      "label": "高祖母",
      "sex": "female",
      "kind": "person",
      "relations": {
        "fa": null,
        "mu": null,
        "xiong": null,
        "di": null,
        "jie": null,
        "mei": null,
        "fu": "paternal-great-great-grandfather",
        "qi": null,
        "zi": "paternal-great-grandfather",
        "nv": null
      },
      "termIds": [
        "term-004"
      ],
      "provenance": [
        "phase1-legacy"
      ],
      "legacyName": "高祖母"
    },
    {
      "id": "paternal-great-grandfather",
      "label": "曾祖父",
      "sex": "male",
      "kind": "person",
      "relations": {
        "fa": "paternal-great-great-grandfather",
        "mu": "paternal-great-great-grandmother",
        "xiong": null,
        "di": null,
        "jie": null,
        "mei": null,
        "fu": null,
        "qi": "paternal-great-grandmother",
        "zi": [
          "paternal-grandfather",
          "paternal-grandfather-older-brother",
          "paternal-grandfather-younger-brother"
        ],
        "nv": [
          "paternal-grandfather-sister"
        ]
      },
      "termIds": [
        "term-005"
      ],
      "provenance": [
        "phase1-legacy"
      ],
      "legacyName": "曾祖父"
    },
    {
      "id": "paternal-great-grandmother",
      "label": "曾祖母",
      "sex": "female",
      "kind": "person",
      "relations": {
        "fa": null,
        "mu": null,
        "xiong": null,
        "di": null,
        "jie": null,
        "mei": null,
        "fu": "paternal-great-grandfather",
        "qi": null,
        "zi": [
          "paternal-grandfather",
          "paternal-grandfather-older-brother",
          "paternal-grandfather-younger-brother"
        ],
        "nv": [
          "paternal-grandfather-sister"
        ]
      },
      "termIds": [
        "term-006"
      ],
      "provenance": [
        "phase1-legacy"
      ],
      "legacyName": "曾祖母"
    },
    {
      "id": "maternal-grandfather-father",
      "label": "外曾祖父",
      "sex": "male",
      "kind": "person",
      "relations": {
        "fa": null,
        "mu": null,
        "xiong": null,
        "di": null,
        "jie": null,
        "mei": null,
        "fu": null,
        "qi": "maternal-grandfather-mother",
        "zi": [
          "maternal-grandfather",
          "maternal-grandfather-older-brother",
          "maternal-grandfather-younger-brother"
        ],
        "nv": "maternal-grandfather-sister"
      },
      "termIds": [
        "term-005"
      ],
      "provenance": [
        "phase1-legacy"
      ],
      "legacyName": "外曾祖父"
    },
    {
      "id": "maternal-grandfather-mother",
      "label": "外曾祖母",
      "sex": "female",
      "kind": "person",
      "relations": {
        "fa": null,
        "mu": null,
        "xiong": null,
        "di": null,
        "jie": null,
        "mei": null,
        "fu": "maternal-grandfather-father",
        "qi": null,
        "zi": [
          "maternal-grandfather",
          "maternal-grandfather-older-brother",
          "maternal-grandfather-younger-brother"
        ],
        "nv": "maternal-grandfather-sister"
      },
      "termIds": [
        "term-006"
      ],
      "provenance": [
        "phase1-legacy"
      ],
      "legacyName": "外曾祖母"
    },
    {
      "id": "paternal-grandfather",
      "label": "祖父",
      "sex": "male",
      "kind": "person",
      "relations": {
        "fa": "paternal-great-grandfather",
        "mu": "paternal-great-grandmother",
        "xiong": "paternal-grandfather-older-brother",
        "di": "paternal-grandfather-younger-brother",
        "jie": "paternal-grandfather-sister",
        "mei": "paternal-grandfather-sister",
        "fu": null,
        "qi": "paternal-grandmother",
        "zi": [
          "father",
          "father-older-brother",
          "father-younger-brother"
        ],
        "nv": "father-sister"
      },
      "termIds": [
        "term-007"
      ],
      "provenance": [
        "phase1-legacy"
      ],
      "legacyName": "祖父"
    },
    {
      "id": "paternal-grandmother",
      "label": "祖母",
      "sex": "female",
      "kind": "person",
      "relations": {
        "fa": null,
        "mu": null,
        "xiong": "paternal-grandmother-brother",
        "di": "paternal-grandmother-brother",
        "jie": "paternal-grandmother-sister",
        "mei": "paternal-grandmother-sister",
        "fu": "paternal-grandfather",
        "qi": null,
        "zi": [
          "father",
          "father-older-brother",
          "father-younger-brother"
        ],
        "nv": "father-sister"
      },
      "termIds": [
        "term-008",
        "term-009"
      ],
      "provenance": [
        "phase1-legacy"
      ],
      "legacyName": "祖母"
    },
    {
      "id": "paternal-grandfather-older-brother",
      "label": "伯祖父",
      "sex": "male",
      "kind": "person",
      "relations": {
        "fa": "paternal-great-grandfather",
        "mu": "paternal-great-grandmother",
        "xiong": "paternal-grandfather-older-brother",
        "di": [
          "paternal-grandfather",
          "paternal-grandfather-older-brother",
          "paternal-grandfather-younger-brother"
        ],
        "jie": "paternal-grandfather-sister",
        "mei": "paternal-grandfather-sister",
        "fu": null,
        "qi": "paternal-grandfather-older-brother-wife",
        "zi": [
          "father-older-paternal-cousin",
          "father-younger-paternal-cousin"
        ],
        "nv": "father-paternal-female-cousin"
      },
      "termIds": [
        "term-010"
      ],
      "provenance": [
        "phase1-legacy"
      ],
      "legacyName": "伯祖父"
    },
    {
      "id": "paternal-grandfather-older-brother-wife",
      "label": "伯祖母",
      "sex": "female",
      "kind": "person",
      "relations": {
        "fa": null,
        "mu": null,
        "xiong": null,
        "di": null,
        "jie": null,
        "mei": null,
        "fu": "paternal-grandfather-older-brother",
        "qi": null,
        "zi": [
          "father-older-paternal-cousin",
          "father-younger-paternal-cousin"
        ],
        "nv": "father-paternal-female-cousin"
      },
      "termIds": [
        "term-011",
        "term-012"
      ],
      "provenance": [
        "phase1-legacy"
      ],
      "legacyName": "伯祖母"
    },
    {
      "id": "paternal-grandfather-younger-brother",
      "label": "叔祖父",
      "sex": "male",